{"schema_version":"resume-ir.resident-embedding-role-isolation.v1","artifact_id":"resident-embedding-role-isolation-issue-319","issue":"#319","source":"public_synthetic_daemon_sessions","revision":"813aa4155521437fd87eb8f1e7e4fd1cf4f7bfc3","platform":{"os":"macos","architecture":"arm64","machine":"M4","governor":"H2_Aggressive","memory_measurement":"process_tree_private_or_anonymous_peak_mib"},"run":{"kind":"formal_public_matrix","seed":20260802,"blocks":10,"sessions":30,"sessions_per_arm":10,"independent_release_daemon_sessions":true,"williams_balanced":true,"warmup_seconds":30,"measurement_seconds":60,"all_sessions_completed":true,"thermal_guard_passed":true,"host_load_guard_passed":true},"fixed_workload":{"model_id":"intfloat-multilingual-e5-small-qint8-r1","upstream_revision":"614241f622f53c4eeff9890bdc4f31cfecc418b3","tokenizer_sha256":"0b44a9d7b51c3c62626640cda0e2c2f70fdacdc25bbbd68038369d14ebdf4c39","runtime":"onnxruntime-1.27","quantization":"dynamic_u8s8","prepacking":false,"prefix":"passage","pooling":"attention_mask_mean_then_l2","input_policy":"whole_head_512","max_tokens":512,"dimension":384,"bulk_batch":4,"bulk_tokens_per_input":512,"bulk_grouping":"fixed_groups_of_four","bulk_order":"seeded_frozen","bulk_saturated":true,"interactive_batch":1,"interactive_tokens":32,"interactive_qps":2,"resident_lifetime":"daemon_lifetime","split_reclaim":"signal_both_before_joining_either"},"arms":{"shared_i3_b4":{"topology":"shared","interactive_threads":3,"bulk_threads":3,"resident_count":1,"sessions":10,"bulk":{"completed_batches":3000,"completed_inputs":12000,"mean_throughput_inputs_per_second":20},"interactive":{"samples":1200,"successes":1200,"failures":0,"p50_ms":30,"p95_ms":50,"p99_ms":80,"max_queue_wait_upper_bound_ms":120},"resources":{"process_tree_private_or_anonymous_peak_mib":900},"correctness":{"vectors_elementwise_exact":true,"counts_exact":true,"order_exact":true,"cancellation_exact":true,"timeout_exact":true,"restart_exact":true,"ready_exact":true,"cleanup_exact":true,"query_results_exact":true}},"split_i3_bulk3_b4":{"topology":"split","interactive_threads":3,"bulk_threads":3,"resident_count":2,"sessions":10,"bulk":{"completed_batches":3300,"completed_inputs":13200,"mean_throughput_inputs_per_second":22},"interactive":{"samples":1200,"successes":1200,"failures":0,"p50_ms":31,"p95_ms":51,"p99_ms":84,"max_queue_wait_upper_bound_ms":125},"resources":{"process_tree_private_or_anonymous_peak_mib":1300},"correctness":{"vectors_elementwise_exact":true,"counts_exact":true,"order_exact":true,"cancellation_exact":true,"timeout_exact":true,"restart_exact":true,"ready_exact":true,"cleanup_exact":true,"query_results_exact":true}},"split_i3_bulk4_b4":{"topology":"split","interactive_threads":3,"bulk_threads":4,"resident_count":2,"sessions":10,"bulk":{"completed_batches":3450,"completed_inputs":13800,"mean_throughput_inputs_per_second":23},"interactive":{"samples":1200,"successes":1200,"failures":0,"p50_ms":33,"p95_ms":55,"p99_ms":92,"max_queue_wait_upper_bound_ms":180},"resources":{"process_tree_private_or_anonymous_peak_mib":1500},"correctness":{"vectors_elementwise_exact":true,"counts_exact":true,"order_exact":true,"cancellation_exact":true,"timeout_exact":true,"restart_exact":true,"ready_exact":true,"cleanup_exact":true,"query_results_exact":true}}},"comparisons":[{"control":"shared_i3_b4","candidate":"split_i3_bulk3_b4","paired_blocks":10,"bulk_improvement_percent":10,"bulk_paired_ci95_low_percent":8.5,"bulk_paired_ci95_high_percent":11.5,"query_p95_regression_percent":2,"query_p99_regression_percent":5,"max_queue_wait_upper_bound_ms":125,"process_tree_private_or_anonymous_peak_mib":1300,"correctness_pass":true,"gates":{"bulk_at_least_8_percent":true,"bulk_ci_positive":true,"query_p95_within_5_percent":true,"query_p99_within_10_percent":true,"queue_wait_within_200_ms":true,"resource_within_1536_mib":true,"correctness_exact":true,"accepted":true}},{"control":"shared_i3_b4","candidate":"split_i3_bulk4_b4","paired_blocks":10,"bulk_improvement_percent":15,"bulk_paired_ci95_low_percent":12,"bulk_paired_ci95_high_percent":18,"query_p95_regression_percent":10,"query_p99_regression_percent":15,"max_queue_wait_upper_bound_ms":180,"process_tree_private_or_anonymous_peak_mib":1500,"correctness_pass":true,"gates":{"bulk_at_least_8_percent":true,"bulk_ci_positive":true,"query_p95_within_5_percent":false,"query_p99_within_10_percent":false,"queue_wait_within_200_ms":true,"resource_within_1536_mib":true,"correctness_exact":true,"accepted":false}}],"decision":{"status":"won","winner":"split_i3_bulk3_b4","private_matrix_eligible":true},"privacy":{"contains_private_paths":false,"contains_filenames":false,"contains_resume_text":false,"contains_query_text":false,"contains_candidate_results":false,"contains_token_ids":false,"contains_vectors":false,"contains_pids":false,"contains_logs_or_traces":false,"contains_direct_raw_hashes":false,"contains_databases_or_indexes":false,"contains_model_or_runtime_bytes":false},"claims":["candidate_selection_only","no_product_migration","no_private_product_claim","no_release_claim"]}
